<?xml version="1.0" encoding="UTF-8"?>
<sp:SciencePaper xmlns:os="http://www.tim12.com/user"
 xmlns:sp="http://www.tim12.com/science_paper"
 xmlns:xsi="http://www.w3.org/2001/XMLSchema-instance"
 xsi:schemaLocation="http://www.tim12.com/science_paper file:/home/classicdocs/Documents/Workspace/xml/xml-papersapp/src/main/resources/data/SciencePaper.xsd">
    <sp:title>title0</sp:title>
    <sp:authors>
        <sp:author>
            <os:firstName>firstName0</os:firstName>
            <os:lastName>lastName0</os:lastName>
            <os:profession>profession0</os:profession>
            <os:phoneNumber>000-000-0000</os:phoneNumber>
            <os:email>0@00.AA</os:email>
            <os:role>editor</os:role>
        </sp:author>
        <sp:author>
            <os:firstName>firstName1</os:firstName>
            <os:lastName>lastName1</os:lastName>
            <os:profession>profession1</os:profession>
            <os:phoneNumber>000-000-0000</os:phoneNumber>
            <os:email>0@00.AA</os:email>
            <os:role>editor</os:role>
        </sp:author>
    </sp:authors>
    <sp:reviewers>
    </sp:reviewers>
    <sp:content>
        <sp:section>
            <sp:title>title1</sp:title>
            <sp:paragraph>
            </sp:paragraph>
            <sp:paragraph>
            </sp:paragraph>
        </sp:section>
        <sp:section>
            <sp:title>title2</sp:title>
            <sp:paragraph>
            </sp:paragraph>
            <sp:paragraph>
            </sp:paragraph>
        </sp:section>
    </sp:content>
    <sp:abstract>
        <sp:purpose>purpose0</sp:purpose>
        <sp:findings>findings0</sp:findings>
        <sp:designMethodologyApproach>designMethodologyApproach0</sp:designMethodologyApproach>
        <sp:researchLimitationsAndImplications>researchLimitationsAndImplications0</sp:researchLimitationsAndImplications>
        <sp:practicalImplications>practicalImplications0</sp:practicalImplications>
        <sp:socialImlications>socialImlications0</sp:socialImlications>
        <sp:originalityAndValue>originalityAndValue0</sp:originalityAndValue>
        <sp:keywords>
            <sp:Kljucna_rec>Kljucna_rec0</sp:Kljucna_rec>
            <sp:Kljucna_rec>Kljucna_rec1</sp:Kljucna_rec>
        </sp:keywords>
        <sp:type>research_paper</sp:type>
    </sp:abstract>
    <sp:references>
        <sp:Referenca>
            <sp:name>name0</sp:name>
            <sp:type>book</sp:type>
        </sp:Referenca>
        <sp:Referenca>
            <sp:name>name1</sp:name>
            <sp:type>book</sp:type>
        </sp:Referenca>
    </sp:references>
</sp:SciencePaper>
