<?xml version="1.0" encoding="UTF-8"?>
<SciencePaper xmlns="http://www.tim12.com/science_paper"
 xmlns:xsi="http://www.w3.org/2001/XMLSchema-instance"
 xsi:schemaLocation="http://www.tim12.com/science_paper file:/home/classicdocs/Documents/Workspace/xml/xml-papersapp/src/main/resources/data/SciencePaper.xsd">
    <title>title0</title>
    <authors>
        <author>
            <firstName>firstName0</firstName>
            <email>author1@gmail.com</email>
            <lastName>lastName0</lastName>
            <profession>profession0</profession>
        </author>
        <author>
            <firstName>firstName1</firstName>
            <email>author2@gmail.com</email>
            <lastName>lastName1</lastName>
            <profession>profession1</profession>
        </author>
    </authors>
    <reviewers>
    </reviewers>
    <content>
        <section>
            <title>title1</title>
            <paragraph>
            </paragraph>
            <paragraph>
            </paragraph>
        </section>
        <section>
            <title>title2</title>
            <paragraph>
            </paragraph>
            <paragraph>
            </paragraph>
        </section>
    </content>
    <abstract>
        <purpose>purpose0</purpose>
        <findings>findings0</findings>
        <designMethodologyApproach>designMethodologyApproach0</designMethodologyApproach>
        <researchLimitationsAndImplications>researchLimitationsAndImplications0</researchLimitationsAndImplications>
        <practicalImplications>practicalImplications0</practicalImplications>
        <socialImlications>socialImlications0</socialImlications>
        <originalityAndValue>originalityAndValue0</originalityAndValue>
        <keywords>
            <Kljucna_rec>Kljucna_rec0</Kljucna_rec>
            <Kljucna_rec>Kljucna_rec1</Kljucna_rec>
        </keywords>
        <type>research_paper</type>
    </abstract>
    <references>
        <Referenca>
            <name>name0</name>
            <type>book</type>
        </Referenca>
        <Referenca>
            <name>name1</name>
            <type>book</type>
        </Referenca>
    </references>
</SciencePaper>
